{
  "schema_version": 1,
  "run_id": "20260101T000000Z-model-a-standard",
  "profile": "standard",
  "outcome": "QUALIFIED",
  "model": {
    "requested": "model-a:latest",
    "config_alias": "model-a",
    "runtime_model": "model-a:latest",
    "runtime_digest": "sha256:aaaaaaaaaaaaaaaaaaaaaaaaaaaaaaaaaaaaaaaaaaaaaaaaaaaaaaaaaaaaaaaa",
    "quantization": "Q8_0",
    "context_length": 131072,
    "reasoning_effort": "medium"
  },
  "provenance": {
    "started_at": "2026-01-01T00:00:00Z",
    "finished_at": "2026-01-01T01:00:00Z",
    "elapsed_seconds": 3600.0,
    "status": "COMPLETE",
    "model_config": {"provider": "gx10", "runtime": "ollama", "context_length": 131072},
    "qualification_generation": "gx10-qualification-v2",
    "scoring_version": "gx10-qualification-v2",
    "profile_config": {"name": "standard", "total_wall_seconds": 18000},
    "upstreams": {
      "spark-bench": {"commit": "1111111111111111111111111111111111111111"},
      "benchlocal-cli": {"commit": "2222222222222222222222222222222222222222"},
      "infermark": {"commit": "3333333333333333333333333333333333333333"}
    }
  },
  "components": {},
  "gates": {"passed": true, "failures": []},
  "scores": {
    "deployment_configuration_score": 82.5,
    "components": {
      "coding": 80.0,
      "hermes": 100.0,
      "tool_instruction": 78.0,
      "reliability": 90.0,
      "performance": 55.0
    },
    "weights": {
      "coding": 40,
      "hermes": 30,
      "tool_instruction": 15,
      "reliability": 10,
      "performance": 5
    },
    "executed_weight": 100,
    "comparable_full_profile": true
  },
  "artifacts": {}
}
